{"artifacts":[{"contract":"audit-worker-result","id":"worker","path":"worker.json","sha256":"1cf8f9176c1fbc0aa497674c2119d90b710ec723496b5e13a5d913cd56a2c7d7"},{"contract":"report-bundle","id":"report","path":"report.json","sha256":"4320ff30ee938f9dd06575e44ce24904a5be57c90fa4cce5e04574a54bc2fc3e"}],"inputs":[{"contract":"account-snapshot","id":"account","kind":"json","path":"account.json","platform":"google","sha256":"6d8baaca247aa0c870719cfb453ff6acb8a64a141779c0294d6d76561951dce4"}],"phase":"Synthetic fixture","run_id":"synthetic-run","schema_version":"1.0.0"}
